{
  "schema_version": "1.0.0",
  "plan_id": "001",
  "unit_id": "06e",
  "tracker_status": "DONE",
  "completion_sha": "7a288d4e95d4560c91e7ebe974ba01bebfca18e0",
  "entries": [
    {
      "kind": "sample-app-cohort-receipt",
      "schema_id": "https://www.saltdesignsystem.com/ai/schemas/salt-sample-app-cohort-receipt-1.json",
      "schema_version": "1.0.0",
      "locator": "repo://plans/evidence/artifacts/sha256-326812440a98da4ed171d63bbef4a5585d351ef33f5d01b2b4b491db273a7eff.json",
      "sha256": "sha256:326812440a98da4ed171d63bbef4a5585d351ef33f5d01b2b4b491db273a7eff",
      "source_sha": "7a288d4e95d4560c91e7ebe974ba01bebfca18e0",
      "completion_sha": "7a288d4e95d4560c91e7ebe974ba01bebfca18e0",
      "workflow_class": "local-ci",
      "environment_class": "local-worktree-node-24",
      "retention_expires_at": "2031-08-28T00:00:00.000Z",
      "state": "active",
      "parents": [
        "sha256:f861774de9d09c4a515fd1535a8a487e0e851bbc0becc25296c7177b7c6387f5"
      ],
      "app": "vite-starter",
      "cohort_package_count": 7,
      "network": "offline-after-install",
      "node_version": "24.10.0",
      "lockfile_sha256": "sha256:cf0b155adf32a0850b9e8fcf4334d4c4b321cee84ea9368a8e47e084382ea29a",
      "bundle_digest": "sha256:00d3fd9da6946bf8f43e2772d97da1860f5840efb636a2a10f2ebee7d5da33aa",
      "semantic_digest": "sha256:a154172176de0ec8e0ec211f1870e20902e333d5101f697a04044ea7a796af15",
      "semantic_source_digest": "sha256:35f06fecd2625ef5a37782303eecfbced1931c9de6c3999ce38709622b93f4ab",
      "compiler_digest": "sha256:48bf067eb3218ddb260a1502a983f9952271b5f7fd19bc4c7f78d819e5218e1a",
      "scan_coverage": "partial",
      "scan_reasons": [
        "SCAN_UNSUPPORTED_CONSTRUCT"
      ],
      "verification": [
        "yarn build",
        "yarn check:salt-sample-apps -- --app vite-starter"
      ]
    }
  ]
}
