{
  "schema_version": "1.0.0",
  "plan_id": "001",
  "unit_id": "06c",
  "tracker_status": "DONE",
  "completion_sha": "dfec7c265684c52d570369b8dfc70015bba377e9",
  "entries": [
    {
      "kind": "migration-receipt",
      "schema_id": "https://www.saltdesignsystem.com/ai/schemas/salt-pattern-migration-receipt-1.json",
      "schema_version": "1.0.0",
      "locator": "repo://plans/evidence/artifacts/sha256-115de2af4cd3fc5cffab8c9cc6fac56201d5be453b8facb54bba8578deb5c32a.json",
      "sha256": "sha256:115de2af4cd3fc5cffab8c9cc6fac56201d5be453b8facb54bba8578deb5c32a",
      "source_sha": "be9bb1d64b7157e3a4cf7c8514653fae99ae5580",
      "completion_sha": "be9bb1d64b7157e3a4cf7c8514653fae99ae5580",
      "workflow_class": "local-ci",
      "environment_class": "local-worktree-node-24",
      "retention_expires_at": "2031-08-28T00:00:00.000Z",
      "parents": [
        "sha256:d967cdeca8ed780380321654987acfe3fc368c99e648b9da6a1942bdb370243e"
      ],
      "state": "active",
      "batch": "06c",
      "result": "pass",
      "publishable": false,
      "policy_profile": "pre-agent-support",
      "baseline_sha256": "sha256:5e6608255233ed61f355769f011b5e340fefec31b99be4c9555616c0f4435f08",
      "inventory_sha256": "sha256:27785d6505a813186089f92c6ae7a2ff09cc74c900186e668aab562da07d9d4d",
      "predecessor_sha256": "sha256:d967cdeca8ed780380321654987acfe3fc368c99e648b9da6a1942bdb370243e",
      "pack_report_sha256": "sha256:48ec6f838f42b3b23178b5fd3f79e297a90b3e1736fb8919764e117403a5a98b",
      "example_manifest_sha256": "sha256:f1ca6723cadbc5f395c161551c3cfaf7fba3b72cd11c7f5d04e9d40810bc85d8",
      "baseline_semantic_digest": "sha256:f2fb02c9e6b999935b1e9727463b4a298492f810e376c434bc3626ab050cccab",
      "semantic_digest": "sha256:0b695f5a5ef61d33abd1acace1cf99d63b65a0fbd4ca5478ab421a1219790cef",
      "semantic_source_digest": "sha256:744b04a8d11d8ba25518a5b96fc30c030cadd4df478f17c5a4194c503121e1ca",
      "compiler_digest": "sha256:3a56024b1ce27e70e4f0961b717908fdcebf4ba9f421e097dfa508ace31f86cf",
      "bundle_digest": "sha256:99df22f94c160988f128d6bcefb7ea72bfb1a88648c91dcae4cb652b91a79400",
      "semantic_change_policy": "canonical-public-destination-expansion/1",
      "compiler_change_policy": "storybook-semantic-input-retirement/1",
      "reviewed_public_destination_count": 5,
      "retired_story_pattern_count": 13,
      "remaining_story_pattern_count": 0,
      "classified_identity_change_count": 19,
      "unclassified_identity_change_count": 0,
      "knowledge_tarball_sha256": "sha256:d305d09c8b3800ace2baf508eb410fbd1eb81817ceb2a2214ad8ab2162cad1de",
      "cli_tarball_sha256": "sha256:3179271a5fb74531950e32e4eed0ecbceaaa3505dc47b69ae4310a2ae9b95599",
      "pattern_count": 24,
      "package_story_count": 8,
      "completed_pattern_count": 24,
      "completed_package_story_count": 8,
      "component_spec_count": 138,
      "component_test_count": 3409,
      "component_passing_count": 3368,
      "component_pending_count": 41,
      "knowledge_test_files": 28,
      "knowledge_tests": 422,
      "ai_tooling_test_files": 69,
      "ai_tooling_tests": 860,
      "verification": [
        "yarn build:ai-tooling",
        "yarn vitest run packages/knowledge/src/__tests__ --maxWorkers=4",
        "yarn test:ai-tooling",
        "yarn check:salt-docs-authoring -- --authoring-stage 06c --migration-batch 06c --visibility-stage 06c --require-storybook-independent",
        "yarn check:ai-tooling:pack -- --profile pre-agent-support --report dist/salt-pattern-migration/06c-pack-report.json",
        "yarn acquire:salt-ai:evidence -- --unit 06b --kind migration-receipt --tracker plans/README.md --output dist/salt-pattern-migration/input/06b-receipt.json",
        "yarn verify:salt-pattern-migration -- --batch 06c --baseline tooling/ai/pattern-migration-v1.json --predecessor-receipt dist/salt-pattern-migration/input/06b-receipt.json --pack-report dist/salt-pattern-migration/06c-pack-report.json --output dist/salt-pattern-migration/06c-receipt.json",
        "yarn build-storybook",
        "yarn test:components"
      ]
    }
  ]
}
